"position.page","position.position","position.global_position","asin","price.discounted","price.current_price","price.currency","price.before_price","price.savings_amount","price.savings_percent","reviews.total_reviews","reviews.rating","url","score","sponsored","amazonChoice","bestSeller","amazonPrime","title","thumbnail"
2,5,12,"B0833T44PY",true,3045,"JPY",4222,1177,27.88,0,0,"https://www.amazon.jp/dp/B0833T44PY",0,false,false,false,false,"Lady Woker (レディワーカー) Women's Asics Wedge Sole Pumps, Wide 3E Equivalent, 1.2 inches (3 cm) Heel LO-17560 Pumps","https://m.media-amazon.com/images/I/61CQgwz3U9L._AC_UL320_.jpg"
1,15,30,"B0BGGVNQX4",true,2576,"JPY",4294,1718,40.01,0,0,"https://www.amazon.jp/dp/B0BGGVNQX4",0,false,false,false,false,"Adidas Men's Core Runner RUNFALCON 3.0 LSI57 Running Shoes","https://m.media-amazon.com/images/I/41EPBPQWpAL._AC_UL320_.jpg"
1,24,39,"B00TM14XZ6",true,3881,"JPY",5725,1844,32.21,0,0,"https://www.amazon.jp/dp/B00TM14XZ6",0,false,false,false,false,"Texcy Luxe TU-7774 Men's Business Shoes, Asics Corporation, Lightweight, Genuine Leather","https://m.media-amazon.com/images/I/71yqn61GL-L._AC_UL320_.jpg"
1,46,61,"B00TM1523I",true,4684,"JPY",5725,1041,18.18,0,0,"https://www.amazon.jp/dp/B00TM1523I",0,false,false,false,false,"Texcy Luxe TU-7774 Men's Business Shoes, Asics Corporation, Lightweight, Genuine Leather","https://m.media-amazon.com/images/I/71LG+fqr4FL._AC_UL320_.jpg"
2,15,71,"B0CXPZJZ4B",true,4360,"JPY",5654,1294,22.89,0,0,"https://www.amazon.jp/dp/B0CXPZJZ4B",0,false,false,false,false,"Lady woker(レディワーカー) レディース アシックス商事 ジブンローファー 生活防水 幅広3E相当 学生ローファー","https://m.media-amazon.com/images/I/61tNUGIkPWL._AC_UL320_.jpg"
3,26,122,"B08SJBKBJ2",true,8067,"JPY",12166,4099,33.69,0,0,"https://www.amazon.jp/dp/B08SJBKBJ2",0,false,false,false,false,"Texy Luxe TU-8005 Men's Business Shoes, Genuine Leather, Gore-Tex, Wide 4E","https://m.media-amazon.com/images/I/71aeNaDTzGL._AC_UL320_.jpg"
3,33,129,"B0B72DF19H",true,2953,"JPY",4222,1269,30.06,0,0,"https://www.amazon.jp/dp/B0B72DF19H",0,false,false,false,false,"Lady Woker (レディワーカー) Women's Asics 3E Equivalent Wedge Sole 1.3 inches (3.4 cm) Heel LO-15550 Pumps","https://m.media-amazon.com/images/I/61KgJgeVdeL._AC_UL320_.jpg"